{
  "$schema": "https://raw.githubusercontent.com/SimonTang02/sharkapoolu_beta/main/schemas/application-profile.schema.json",
  "schema_version": 1,
  "fields": {
    "how_did_you_hear": "",
    "previous_nvidia_worker": null,
    "first_name": "",
    "last_name": "",
    "preferred_name": "",
    "chinese_name": "",
    "native_first_name": "",
    "native_last_name": "",
    "email": "",
    "phone": "",
    "address_line_1": "",
    "city": "",
    "postal_code": "",
    "country": "",
    "date_of_birth": "",
    "linkedin_url": "",
    "github_url": ""
  },
  "documents": {
    "resume_path": "private_data/cv/build/current.pdf",
    "cover_letter_path": ""
  },
  "education": [
    {
      "school": "",
      "degree": "",
      "field_of_study": "",
      "gpa": "",
      "from_month": null,
      "from_year": null,
      "to_month": null,
      "to_year": null,
      "portal_values": {}
    }
  ],
  "languages": [
    {
      "language": "",
      "native": false,
      "proficiency": ""
    }
  ],
  "work_experience": [],
  "projects": [],
  "skills": [],
  "workday_checkbox_groups": {},
  "custom_answers": {
    "Are you legally authorized to work in the country where this position is located?": null,
    "Will you require employer support to obtain or maintain authorization to work in that country?": null
  },
  "answer_rules": [],
  "voluntary_disclosures": {
    "gender": null,
    "accept_terms": false
  },
  "explicit_authorization": {
    "user_confirmed": false,
    "location_scopes": [],
    "work_authorized": null,
    "sponsorship_required": null,
    "company_consents": {}
  },
  "career_preferences": {
    "accept_role_or_city_adjustment": null,
    "resume_language_policy": {
      "china_owned_employers": "",
      "other_employers": "",
      "explicit_role_language_requirement_overrides_default": true,
      "preferred_pages": 2,
      "max_pages_preferred": 2,
      "rendered_pdf_review_required": true,
      "chinese_font": ""
    }
  },
  "personal_facts_confirmation": {
    "date": "",
    "source": "",
    "notes": "Use this optional object for dated, candidate-confirmed facts that do not yet have a stable first-class field."
  },
  "safety": {
    "allow_sensitive_answers": false,
    "allow_server_draft": false,
    "allow_submit": false
  }
}
